id,title,price,brand,Combined_remas,Combined_paskirtis,Combined_tipai,Combined_skersmuo,Combined_gears,Combined_gearsI
1195,Dviratis Merida Big.Nine 20 VI1 matt fall žalias(juodas)-51 cm / XL (Dydis: 51 cm / XL),679,Merida,Aliuminis 46 cm / XS ALLOY,,,,10,10
1196,"Dviratis Romet Wagant 3 2024 dark auksinis-23"" / XL (Dydis: 23"" / XL)",419.68,Romet,"Aliuminis 19"" / 29 / L 19 ALLOY",Vyrams,,19,12,12
1197,Dviratis Dviratis Cube Numove 120 RT juodas'n'oranžinis 2025,399,Cube,Aliuminis,,,29,"Shimano Tourney TY300, 24 pavarų Shimano ST-EF500",3
1198,Dviratis Cube Nature EXC Trapeze polarsilver'n'juodas 2023-46 cm / XS (Dydis: 46 cm / XS),1023.22,Cube,"Aliuminis 19"" / L 19 ALLOY",Paaugliams,,26,21,21
1199,"Elektrinis dviratis Cube Reaction Hybrid Race 750 29 pilkas'n'metal 2023-19"" / 29 / L (Dydis: 19"" / 29 / L)",3016.34,Cube,"Aliuminis 20"" / XL 20 ALLOY",,,20,16,16
1200,Dviratis 29 CLASSIC TEAM 29 24k 29 juodas classic,507,CLASSIC,HI-TEN STEEL HI-TEN STEEL,Vaikams,,14,1,1
1201,"Dviratis Romet Jolene 6.1 26"" 2022 žalias-violet-19"" / L (Dydis: 19"" / L)",293.35,Romet,Aliuminis 50 cm / S ALLOY,Paaugliams,,,8,8
1202,"Dviratis Romet Rambler FIT 26 2024 bordo-sidabrinis-20"" / XL (Dydis: 20"" / XL)",419.68,Romet,Aliuminis 23,Moterims,,23,24,24
1203,Dviratis Karbon Niki 14 žalias-mėlynas,189,Karbon,Aliuminis 38 cm / S ALLOY,,,,,
1204,Dviratis Cube Nature graphite'n'juodas 2023-50 cm / S (Dydis: 50 cm / S),644.25,Cube,"Aliuminis 20"" / L 20 ALLOY",Paaugliams,,,,
1205,"Dviratis UNIBIKE Vision GTS 2022, juodas (Dydis: 23"")",495.93,Unibike,"Aliuminis 19"" 19 ALLOY",,,19,,
1206,Dviratis Merida Big.Seven 20 VI1 baltas(violetinė)-38 cm / S (Dydis: 38 cm / S),669,Merida,Aliuminis 54 cm / M ALLOY,Moterims,,,10,10
1207,"Dviratis Romet Orkan 3 M Lite 28"" 2023 juodas-sky mėlynas-20"" / L (Dydis: 20"" / L)",529,Romet,,Paaugliams,,,,
1208,"Dviratis Unibike Move 29 2024 juodas-19"" (Dydis: 19"")",659,Unibike,"CARBON 17"" / L 17 CARBON",,,,12,12
1209,Dviratis Cube Nature SLX pilkas'n'juodas 2023-54 cm / M (Dydis: 54 cm / M),1402.20,Cube,"Aliuminis 20"" / XL 20 ALLOY",Paaugliams,,27.5,,
1210,"Insera Central 7-v -polkupyörä, 50 cm",419.99,Insera,Aliuminis 48 cm / L ALLOY,,,,,
1211,"Elektrinis dviratis Cube AMS Hybrid ONE44 C:68X SLT 400X 29 carbon'n'golddust 2025-17"" / L (Dydis: 17"" / L)",7999,Cube,"ALLOY 19"" / M 19 ALLOY",Paaugliams,,27,7,7
1212,"Dviratis Romet Rambler FIT 27.5"" 2023 juodas-red-20"" / XL (Dydis: 20"" / XL)",433.71,Romet,Aliuminis 47 cm / L ALLOY,,,,,
1213,Dviratis Merida Big.Seven 20 VI1 baltas(violetinė)-48 cm / L (Dydis: 48 cm / L),669,Merida,"Aliuminis 20"" / L 20 ALLOY",,,,10,10
1214,"Dviratis Romet Wagant 1 2024 juodas-red-19"" / M (Dydis: 19"" / M)",377.57,Romet,Aliuminis ALLOY,Vaikams,,,1,1
1215,Dviratis Merida Matts 70 I1 oranžinis(red)-47 cm / L (Dydis: 47 cm / L),799,Merida,"Aliuminis 19"" / L 19 ALLOY",,,,,
1216,"Dviratis Romet Rambler R9.3 CS 2024 baltas-graphite-turquoise-20"" / L (Dydis: 20"" / L)",560.04,Romet,"CARBON 20"" / 29 / L 20 CARBON",Vyrams,,20,12,12
1217,Dviratis Dviratis Cube Numove 120 RT mėlynas'n'lime 2025,399,Cube,Aliuminis 50 cm / S ALLOY,Paaugliams,,,30,30
1218,"Dviratis Romet Mustang M7.1 27.5"" 2023 juodas-red-19"" / L (Dydis: 19"" / L)",489.86,Romet,"CARBON 20"" / 29 / L 20 CARBON",Vyrams,,20,12,12
1219,"Elektrinis dviratis Cube Stereo Hybrid 140 HPC SLX 750 29 liquidblue'n'mėlynas 2023-20"" / 29 / L (Dydis: 20"" / 29 / L)",4209.40,Cube,"Aliuminis 21"" / 29 / XL 21 ALLOY",Vyrams,,21,12,12
1220,Dviratis Cube Nature Pro auksinis'n'juodas 2023-50 cm / S (Dydis: 50 cm / S),840.76,Cube,Aliuminis 46 cm / XS ALLOY,,,,9,9
1221,"Dviratis Cube Elite C:68X SLX 29 teamline 2023-20"" / 29 / L (Dydis: 20"" / 29 / L)",4209.40,Cube,"Aliuminis 18"" / M 18 ALLOY",Paaugliams,,,,
1222,"Elektrinis dviratis Cube Reaction Hybrid Race 750 29 olive'n'žalias 2023-21"" / 29 / XL (Dydis: 21"" / 29 / XL)",3016.34,Cube,"Aliuminis 23"" / 29 / XXL 23 ALLOY",Vyrams,,23,12,12
1223,Elektrinis dviratis Cube Nuride Hybrid Performance 500 Allroad Easy Entry metalblue'n'red 2023-46 cm / XS (Dydis: 46 cm / XS),2033.82,Cube,,,,,,
1224,"Dviratis Romet Orkan 3 M Lite 28"" 2023 graphite-lemon-18"" / M (Dydis: 18"" / M)",419.68,Romet,Aliuminis 54 cm / M ALLOY,Moterims,,,8,8
1225,"Elektrinis dviratis Cube Reaction Hybrid Race 750 29 olive'n'žalias 2023-23"" / 29 / XXL (Dydis: 23"" / 29 / XXL)",3016.34,Cube,Aliuminis ALLOY,Vaikams,,,,
1226,"Author Solution 29'' dviratis, sidabrinis, 52cm",539.99,Author,,Vyrams,,,11,11
1227,Elektrinis dviratis Cube Supreme Hybrid Pro 625 Easy Entry red'n'juodas 2023-54 cm / M (Dydis: 54 cm / M),2525.08,Cube,,Vyrams,,,,
1228,"Dviratis Royal Baby BELT Lite 16"" pilkas mėlynas",359,Royal Baby,,"Moterims
Vyrams",,,7,7
1229,"Dviratis Vaast A/1 APEX 1X 700C, dydis L 56 cm, juodos spalvos",1929.99,Vaast,,,,21,,
1230,"Dviratis Vaast U/1 700C, M (46cm), mėlynas (Gloss mėlynas)",899.99,Vaast,,,,,,
1231,The-sliders Lite Navy Mėlyna bike- hulaj leg 2in1,569.99,The Sliders,,"Moterims

Vyrams

Paaugliams",,,,
1232,"Sharp Hibridinis elektrinis dviratis, 21"", 250W, Sidabrinės spalvos (BK-RS08-ES)",2049.99,Sharp,,Vyrams,,,,
1233,"GZR Juodas Raw 3.0 -sähköfatbike, 17",3129.99,GZR,,Vaikams,,,,
1234,"Helkama jopo -polkupyörä, valkoinen, 24",409.99,Helkama,,,,,21,21
1235,"Baana Noux -gravelpyörä, L/56 cm",1419.99,Baana,,,,,,
1236,Spin Master Vaikiškas dviratis Paw Patrol The Paw Patrol 1281 (12 ),148.99,Toimsa,,,,,7,7
1237,"Elektrinis dviratis Fafrees F28 MT, 27.5"", juodas, 250W, 14,5Ah",934.99,Fafrees,,,,,,
1238,"Elektrinis dviratis Fafrees F20 Mate 20"", mėlynas, 500W, 18,2Ah",2422.49,Fafrees,,,,,,
1239,"Elektrinis dviratis Eleglide C1 ST Mid-Drive, 27.5"", 250W, Mid-Drive, 14,5Ah, pilkas",1399.99,Eleglide,,,,,,
1240,"Elektrinis dviratis Fafrees F26 Pro 26"", žalias, 250W,14,5Ah",1189.99,Fafrees,,,,,7,7
1241,"Elektrinis dviratis Fafrees F28 MT, 27.5"", baltas, 250W, 14,5Ah",934.99,Fafrees,,,,,,
1242,"Elektrinis dviratis Fafrees F20 X- Max 20"", pilkas, 750W, 30Ah",2039.99,Fafrees,,,,,21,21
1243,"Elektrinis dviratis FAFREES F20 Pro, 20"", violetinis, 250W, 18Ah",1359.99,Fafrees,,,,,,
1244,"Elektrinis dviratis Fafrees FF20 Polar 20"", raudonas, 500W, 20,8Ah",1869.99,Fafrees,,,,,,
1245,"Elektrinis dviratis Fafrees F28 MT, 27.5"", juodas, 250W, 14,5Ah",934.99,Fafrees,,,,,,
1246,"Elektrinis dviratis Duotts N26, 26"", 1500W, 20Ah SAMSUNG, juodas/raudonas",2039.99,Duotts,Aliuminis,Apytikslis amžius 5-7 metų Vaikams,,20 20,SHIMANO Nexus SHIMANO Nexus SL-C3000 Revoshift 7,7
1247,"Elektrinis dviratis FAFREES F1-38C, 28"", baltas",1019.99,Fafrees,Aliuminis Vyriškas,Vyrams,Vieta,28 28,Shimano Deore RD-M6000-SGS Shimano SL-T6000 10 Išorinės,10 Nėra
1248,"Elektrinis dviratis Fafrees FM9 29"", pilkas, 250W, 15Ah",2124.99,Fafrees,Aliuminis,Apytikslis amžius 7-9 metų Vaikams,,24 24,SHIMANO Tourney RD-TY200 SHIMANO SL-RS36 Revoshift 18,18
1249,Dviratis 20 Pegasus Avanti 7g wave baltas 28 cm,649.95,Pegasus,Aliuminis Unisex,Vyrams,Vieta,28 28,Shimano Deore RD-M6000-SGS Shimano SL-T6000 10 Išorinės,10 Nėra
1250,Dviratis 28 elektrinis Bulls Lacuba EVO 10 740wh vyr. 10g mėlynas,4099,Bulls,Aliuminis Vyriškas,Vyrams,Vieta,28 28,Shimano Nexus 5 Shimano Nexus 5 5 Vidinės,5 Nėra
1251,Dviratis 24 Pegasus Avanti 18g juodas 32 cm,599.95,Pegasus,Aliuminis Unisex,Vyrams,Vieta,28 28,Shimano Nexus 8 Shimano Nexus SL-C6000 Revoshift 8 Vidinės,8 Nėra
1252,Dviratis 28 elektrinis Bulls Lacuba EVO 10 555Wh 10g wave mėlynas,3799,Bulls,,,,,5,5
1253,Dviratis 28 elektrinis Bulls Tourer EVO 5R FIT 555Wh vyr. 5g juodas,4149,Bulls,Aliuminis Vyriškas,Vyrams,,28 28,SHIMANO GRX RD-RX812 Shadow Plus SHIMANO GRX ST-RX810,1
1254,Dviratis 28 elektrinis Pegasus Ravenna EVO 8F NL 500Wh wave 8g t.žalias,3499,Pegasus,Aliuminis,Vyrams,,29 29,SHIMANO Deore XT RD-M8100-12-SGS Shadow Plus SHIMANO Deore SL-M6100-IR I-Spec EV,1
1255,"Elektrinis dviratis Eleglide T1 Step-Thru 27.5"", 250W, 13Ah, baltas",1189.99,Eleglide,Aliuminis,Apytikslis amžius 5-7 metų Vaikams,,20 20,Shimano Tourney TY-300 7,7
1256,Dviratis 28 Bulls Trail Grinder 11g GRAVEL mėlynas,2399,Bulls,Aliuminis Moteriškas,Vyrams,Hibridinis/krosinis,28 28,Shimano Tourney RD-TY300 Shimano Tourney ST-EF41 21,21 3
1257,Dviratis 29 Bulls Copperhead 3 Plus 12g juodas,1699,Bulls,Aliuminis Moteriškas,Vyrams,Vieta,28 28,Shimano Nexus 8 Shimano Nexus SL-C6000-8 8 Vidinės,8 Nėra
1258,Dviratis 20 Classic Avenue baltas + ruda basket,467,CLASSIC,Aliuminis,Apytikslis amžius 7-9 metų Vaikams,,24 24,SHIMANO Nexus SHIMANO Nexus SL-3S41E Revoshift 3,3
1259,Dviratis 28 Bulls Wildcross trapez 21g raudonas,649.95,Bulls,,,,,5,5
1260,Dviratis 28 elektrinis Pegasus Solero E8F Lite 400Wa baltas + spyna AXA Victory+Akkuschlos Bosch,2849,Pegasus,,,,,,
1261,Dviratis 24 Pegasus Avanti 3g wave juodas 32 cm,599.95,Pegasus,Aliuminis,Vyrams,,29 29,Shimano Tourney RD-TY300 Shimano Tourney ST-EF41,3
1262,"Elektrinis dviratis Eleglide T1 27.5"", 250W, 13Ah, pilkas",1189.99,Eleglide,Plieninis,Apytikslis amžius 3-4 metų Vaikams,,16,,
1263,"Elektrinis dviratis Eleglide M2, 27.5"", 250W, 15Ah, juodas",1019.99,Eleglide,Aliuminis Moteriškas,Vyrams,Vieta,28 28,SHIMANO Nexus SG-3C41 SHIMANO Nexus SL-3S41E Revo Shifter 3 Vidinės,3 1
1264,Dviratis 29 Bulls Wildtail 1 Disc 21g vyr.raudona/juoda,599.95,Bulls,Aliuminis Vyriškas​,Vyrams,,28,Nėra Shimano Revo SL-RS36 Išorinės,1
1265,Dviratis 16 Classic girl baltas + baltas bask+B105:B121et,253,CLASSIC,Aliuminis Vyriškas,,Kalnų MTB,29,"Shimano Deore, 10 greičių Shimano Alivio Išorinės",1
1266,Dviratis 28 Pegasus Bici Italia 3g šv. rožinis,599.95,Pegasus,CrMo,,,20 20,,1
1267,Dviratis 28 CLASSIC DELUXE 7 MEN ALU EQ 28 juodas classic,507,CLASSIC,Aliuminis Unisex,,Sulankstomi,20 20,Shimano 7-pavarų Shimano Išorinės,1
1268,"Dviratis 29"" elektrinis Bulls Sonic EVO 1 vyr. 500Wh 10g raudonas",3599,Bulls,Plieninis,,,20.5 20,,
1269,Dviratis 20 KHE BMX SILENCER LT juodas,599,KHE,Plieninis Unisex​,,,24,Nėra Nėra Nėra,1
1270,Volta Motors Dviratis 20 elektrinis sulankstomas FAT VTA VB2 250W juodas,899,Volta Motors,Plieninis,,,29,"Shimano Tourney RD-TY300, 24 pavarų Shimano ST-EF500, 3x8",3
1271,"Dviratis 20,5 HARO BMX INSPIRED mėlynas",469,HARO,Plieninis,,,29,"Shimano Tourney RD-TY21, 21 pavarų Shimano SL-RS35 Revoshift, 3x7 21",21 3
1272,Dviratis 24 CLASSIC FUNK 24 1s 24 sidabrinis classic,284,CLASSIC,Aliuminis Unisex,,Vieta,20,Shimano 7 pavarų Shimano pavarų perjungimo rankenėlės 7 Išorinės,7 1 priekinė žvaigždė
1273,Dviratis 29 CLASSIC PRO 29 Disc 24spetallic classic,609.01,CLASSIC,Plieninis Moteriškas​,,,28,Nėra Shimano Revo SL-RS36 7 Išorinės,7 1
1274,Dviratis 29 CLASSIC TEAM 29 21sp mėlynas classic,487,CLASSIC,Aliuminis,,,20 20,Vidinės,1
1275,Dviratis 20 elektrinis Engwe L20 500 Wh žalias,1049,Engwe,Aliuminis,,,20 20,Vidinės,1
1276,Dviratis 28 CLASSIC ELEGANCE 28 7sp baltas + basket classic,476.99,CLASSIC,Aliuminis Vyriškas,Paaugliams,,28 28,"Shimano GRX RX400, Shadow Plus Shimano GRX 400 2x10",2
1277,"Dviratis 20"" Pegasus sulankstomas Alu D3A Low 3-G Nexus baltas/pilkas",699.95,Pegasus,Karboninis Vyriškas,Paaugliams,,28 28,SHIMANO GRX RD-RX812 Shadow Plus SHIMANO GRX ST-RX600,1
1278,"Dviratis 20"" Pegasus sulankstomas Alu P8A 8-G matt juodas",699.95,Pegasus,Aliuminis Unisex,Moterims,Vieta,28 28,Nėra Nėra vienos pavaros,1
1279,"Dviratis 28"" GT GRADE COMP juodas (G11502M20/ING)",1599.90,GT-,Aliuminis Vyriškas,Paaugliams,Vieta,28 28,Nėra Nėra vienos pavaros,1
1280,"Dviratis 28"" Bulls Machete Gravel 11g žalias",2599,Bulls,Aliuminis,Vaikams,,26 26,"microSHIFT RD-M26 MicroSHIFT MEZZO TS38-7, 3x7",3
1281,"Dviratis 28"" elektrinis Tenways CGO800S 250Wh unisex juodas matinis 48cm one size",1898,Tenways,Aliuminis Unisex,Moterims,Vieta,28 28,Nėra Nėra vienos pavaros,1
1282,"Dviratis 28"" elektrinis Tenways CGO600 PRO 250Wh vyr. pilkas matinis",1798,Tenways,Aliuminis,"Moterims
Vyrams",,,,
1283,"Dviratis 26"" GT Laguna sidabrinis G28151F10",399.90,GT-,Aliuminis Unisex,,Sulankstomi,20,Shimano 7 pavarų Shimano pavarų perjungimo rankenėlės 7 Išorinės,7 1 priekinė žvaigždė
1284,"Dviratis 28"" elektrinis Tenways CGO800S 374Wh unisex pilkas matinis 48cm one size",1898,Tenways,Aliuminis Vyriškas​,,,28,Nėra Shimano Revo SL-RS36 Išorinės,1
1285,"Beaster Scooter El. Dviratis BEASTER, BS120B",1808.90,Beaster Scooter,Aliuminis Unisex,,Sulankstomi,20,Nėra galinio pavarų perjungėjo Nėra Vienos pavaros,1
1286,Dviratis 20 elektrinis Engwe M20 750Wh dviguba baterija baltas,1299,Engwe,Aliuminis Vyriškas​,,,28,"Shimano RD-T4000 Shimano ST-EF505, 3x8-speed Išorinės",3
1287,Dviratis 28 CLASSIC DELUXE 7 28 baltas classic,406,CLASSIC,Aliuminis Unisex,,Vieta,20,Shimano 7 pavarų Shimano pavarų perjungimo rankenėlės Išorinės,1 priekinė žvaigždė
1288,Dviratis 20 elektrinis sulankstomas Engwe P20 250Wh baltas,999,Engwe,Aliuminis 6061,,,20,Nėra Shimano Revoshift Išorinės,1
1289,Dviratis 28 BERGAMONT HORIZON 4 GENT bergamont,799,Bergamont,Aliuminis Unisex,,Vieta,28,Shimano TY300 7 pavarų L-TWOO 7 pavarų trigeris Išorinės,1
1290,Dviratis 20 elektrinis Engwe L20 Boost 250Wh Step-Thru,1299,Engwe,Aliuminis Unisex,,Vieta,27.5,Shimano 9-speed Shimano 9-speed Išorinės,1
1291,CLASSIC Dviratis 20 CITY SOURCE 20 red monty s,549,CLASSIC,Aliuminis,Vaikams,,20,"Shimano RD-TY300, 7 pavaros Shimano SL-RS36, 7 greičių revo-shifter",
1292,Dviratis 28 LETS COMMUTE pilkas reid,1249,,Aliuminis,,,29,"Shimano Tourney RD-TY300, 21 pavarų Shimano SL-RS35 Revoshift, 3x7",3
1293,"Dviratis 27,5 elektrinis Engwe P275 ST juodas",1449,Engwe,Karboninis Gravel​,,,28,"Shimano GRX RD-R810, 22 pavaros Shimano GRX ST-RX810, 22 pavaros",2
1294,Dviratis 20 BERGAMONT BERGAMONSTER 20 Mėlynas 20 mėlynas bergamont,439,Bergamont,Aliuminis Vyriškas,,Kalnų MTB,26,Shimano RD-M4120 Deore Shadow Shimano SL-M4100 Deore Išorinės,1
1295,Dviratis 29 CLASSIC TEAM 29 21k 29 mėlynas classic,487,CLASSIC,,"Moterims
Vyrams",,,7,7
1296,Dviratis 28 BERGAMONT Gravel s GRANDURANCE RD ELITE 54 juodas bergamont,3499.01,Bergamont,Aliuminis,Vaikams,,27.5,"MicroSHIFT Acolyte RD-M5185M, 8 pavarų MicroSHIFT Acolyte SL-M7180-R Xpress, 8 greičių",2
1297,Dviratis 26 TUNTURI E-MAX RIGID 26 tunturi,3349,Tunturi,Aliuminis Unisex,,Sulankstomi,20,Shimano Altus 8-pavarų Shimano Altus Išorinės,1
1298,"The-sliders Šviesiai baltas skoningas ir patogus, lankstymo dviratis, motoroleris 2in1",569.99,The Sliders,Aliuminis,,,20,Nėra Nėra Išorinės,1
1299,"Dviratis 27,5 HARO DOUBLE PEAK SPORT 27,5 polished haro",849,HARO,Aliuminis,Vaikams,,24,"Shimano RD-TX800 Shimano SL-RS45, 8 pavaros",
1300,Dviratis 20 elektrinis sulankstomas Engwe Engine PRO 2.0 832Wh juodas,1499,Engwe,Aliuminis,Vaikams,,24,"Shimano Tourney TY-300, 7-speed Shimano 7-speed",
1301,Dviratis 20 HARO ANNEX SI 20 20 juodas haro,379,HARO,Aliuminis,Vaikams,,26,Netaikoma (single speed) Netaikoma (single speed),1
1302,Dviratis 24 BERGAMONT REVOX 24 Juodas 24 juodas bergamont,499,Bergamont,Aliuminis,Vaikams,,24,"Shimano RD-TX800 Shimano SL-RS45, 8 pavaros",
1303,Dviratis 24 CLASSIC PRO 24 BOY 24 mėlynas classic,467,CLASSIC,Aliuminis Unisex,,Sulankstomi,20,Shimano 7-pavarų Shimano 7 Išorinės,7 1
1304,Dviratis 26 BERGAMONT KIEZ DIRT 26 bergamont,999,Bergamont,,Vaikams,,,,
1305,Dviratis 24 BERGAMONT REVOX 24 LITE Baltas 24 baltas bergamont,549,Bergamont,Aliuminis ALLOY,Vaikams,,20,3,3
1306,Dviratis 20 elektrinis sulankstomas Engwe EP-2 PRO 750Wh oranžinis,999,Engwe,,,,21,,
1307,Lean Cars Automobilio akumuliatoriaus priekinis/galinis jungiklis,7.27,Lean Cars,Aliuminis Vyriškas,Vyrams,Hibridinis/krosinis,"28 28""",SHIMANO RD-M2000 SHIMANO Altus SL-M2010 27,27 3
1308,Dviratis PUKY Skyride 20-3 Classic Alu retro mėlynas,648.35,Puky,"Aliuminis 20"" / L 20 ALLOY",Paaugliams,,28,3,3
1309,"Sharp hibridinis elektrinis dviratis | 250 W | 21 "" | Baltas Glossy",1719.99,Sharp,"Aliuminis 18"" / M 18 ALLOY",Moterims,,,,
1310,Dviratis 28 Bulls Crossbike 2 vyr. 27g juodas,849.95,Bulls,,,,,,
1311,"Dviratis Romet Pop Art Classic 28"" Alu 2022 mėlynas mat-20"" / L (Dydis: 20"" / L)",438.90,Romet,,,,,,
1312,"Dviratis Romet Rambler R9.3 29"" LTD 2023 baltas-auksinis-18"" / M (Dydis: 18"" / M)",528.90,Romet,anglies,,,,,34
1313,Dunlop dviračio žibintas diodinis 2 vnt. SC,17.63,Dunlop,anglies,,,,,
1314,Body Sculpture treniruoklis BC 1430 V2.0,134.95,Body Sculpture,,,,,,
1315,MMR MPN,2799.99,MMR,,,,,,
1316,Mountain bike MMR RAKISH 00 - Juodas N Raudona - dydis XL / 23/2024,2615.99,MMR,,,,,,
1317,Spokey Cherub dviratininko šalmas 927783,39.58,Spokey,,,,,,
1318,Bėgimo dviratis TCV-T700 HS-TNK-000008333,27.05,,,,,,,
1319,Globber Bell 533-210 HS-TNK-000015721 motorolerio skambutis,23.34,Globber,,,,,,
1320,Globber Bell motorolerio skambutis 533-106 HS-TNK-000015717,23.34,Globber,,,,,,
1321,Globber Bell motorolerio skambutis 533-206 HS-TNK-000015720,23.34,Globber,,Vaikams,,,,
1322,Globber Lock pakabinamos spynos apsauginis užsegimas 532-110 532-110,23.87,Globber,,Vaikams,,,,
1323,Globber daugiaspalvė LED šviesa 522-103 HS-TNK-000011050,20.29,Globber,,,,,,
1324,Meteor dviratininko šalmas PNY11 Jr 25244,42.67,,,,,,,
1325,Globber GO Bike DUO krosinis dviratis 614-100 Navy Mėlyna,71.92,Globber,,,,,,
1326,Adidas Predator SG Lge futbolo apsauginės medžiagos H65529,38,Adidas,,,,,,
1327,NORDICTRACK C 5.5 programuojamas orbitinis įrenginys,1991.79,,,,,,,
1328,Spokey Speed dviratininko šalmas 55-58 cm 926882,35.28,Spokey,,,,,,
1329,Globber daugiaspalvė LED šviesa 522-102 HS-TNK-000011049,20.29,Globber,,Vaikams,,,,
1330,Dviračių šalmas su žibintais Spokey Pointer M 941260,81.18,Spokey,,,,,,
1331,Pink Meteor Rožinė Jr dviratininkų pirštinės 26196-26197-26198,20.86,Pink,,,,,,
1332,Meteor dviratininko šalmas PNY11 Jr 25236,37.82,,,,,,,
1333,Dviračių šalmas Spokey Spectro 55-58 cm 922189,52.82,Spokey,,,,,,
1334,Dviračių užraktas Meteor Blocker 31524,25.67,,,,,,,
1335,Tempish Skillet X šalmas 102001084,56.33,Tempish,,,,,,
1336,Dviračių šalmas su žibintais Spokey Pointer 941261,81.18,Spokey,,,,,,
1337,Globber Explorer Trike Mint 4-in-1 dviratis 632-206-2,174.74,Globber,,,,,,
1338,"GZR Forzar-e SH -sähköpyörä, 49 cm",2009.99,GZR,,,,,,
1339,Pirštinės Globber 528-100 XS 2+ Naujos raudonos-Racing Jr HS-TNK-000013851,22.58,Globber,,,,,,
1340,Globber Explorer Trike 4-in-1 dviratis 632-106-2 HS-TNK-000013808,174.74,Globber,,Vaikams,,,,
1341,Globber Bell 533-100 HS-TNK-000015716 motorolerio skambutis,23.34,Globber,,,,,,
1342,Schwinn 510U programuojamas dviratis 100935,861.02,,,,,,,
1343,Spokey Florist Jr dviratininko šalmas 927772,29.72,Spokey,,,,,,
1344,Rower magnetyczny programowany HMS Premium M9239P,317.62,,,,,,,
1345,adidas tinklinio kelio įtvarai 5 colių KP IW1504,39.88,Adidas,,,,,,
1346,Spokey naujos Lady Fit M W fitneso pirštinės SPK-943727,24.55,Spokey,,,,,,
1347,Dviračių pirštinės Spokey Fun RD Jr S SPK-941126,20.54,Spokey,,"Moterims
Vyrams",,,,
1348,Spokey Hikier M W SPK-943723 fitneso pirštinės,28.89,Spokey,"Aliuminis 19"" / L 19 ALLOY",Paaugliams,,28,21,21
1349,Spokey Bolster XL W fitneso pirštinės SPK-943722,29.83,Spokey,Aliuminis L(19) 19 ALLOY,Paaugliams,,27.5,8,8
1350,"Elektrinis dviratis ADO A16 XE, Baltas",681.84,ADO,,,,,,
1351,"Dviratis Romet Orkan M 2024 juodas-auksinis-19"" / L (Dydis: 19"" / L)",368.90,Romet,,,,,,
1352,Dviratis Merida BIG.SEVEN 20-2X baltas-L(19) (Dydis: L(19)),698.90,Merida,aliuminis,,,,,
1353,Dviratis 28 CLASSIC STREET 21 LADY EQ 28 classic,507,CLASSIC,,Vaikams,,,,
1354,Dviračio skambutis 175348,18.19,,,,,,,
1355,City/Gravel bike MMR METRO - Juodas N Sidabrinis - dydis XL / 23/2024,1079.99,MMR,,,,,,
1356,Globber Lime Žalias Jr šalmas 506-106,48.43,Globber,,,,,,
1357,Globber GO BIKE ELITE 710-110 krosinis dviratis,90.74,Globber,,,,,,
1358,Dviratininko šalmas Spokey BMX Ninja r.50-53cm BKnew SPK-943425,39.03,Spokey,,,,,,
1359,Kelių apsaugos tinkliniui adidas Primeknit KP IW1500,50.11,Adidas,,,,,,
1360,Globber GO BIKE ELITE krosinis dviratis 710-106,90.74,Globber,,,,,,
1361,Radvik Hint dviračio rankenos 92800350121,24.04,Radvik,,,,,,
1362,Rower spinningowy Spokey Shoto 929815,334.38,Spokey,,Vaikams,,,,
1363,adidas X SG League futbolo kamuolio apsauginės juostos IA0842,37.66,Adidas,,,,,,
1364,Spokey dviratininko pirštinės Avare M BK/RD M SPK-941080,27.35,Spokey,,,,,,
1365,Spokey Hasbro Pony Jr dviratininko šalmas 941295,33.21,Hasbro,,,,,,
1366,adidas Tiro Training treniruočių futbolo protektoriai HN5604,29.04,Adidas,,Vaikams,,,,
1367,adidas Tiro SG klubo apsauginės juostos HN5600,28.34,Adidas,,Vaikams,,,,
1368,Radvik Hint dviračio rankenos 92800350120,24.04,Radvik,,,,,,
1369,Šalmas Globber Petrol Mėlyna 505-300,40.23,Globber,,,,,,
1370,Globber pastelinės mėlynos spalvos jaunesniojo amžiaus šalmas 506-200,48.43,Globber,,,,,,
1371,Dunlop dviračių skambutis Ø 48 mm,15.53,Dunlop,,,,,,
1372,Dviračio krepšys po balneliu Dunlop neperšlampama daiktadėžė,21.92,Dunlop,,,,,,
1373,"Dunlop LED dviračių žibintų rinkinys, USB įkrovimas, galinis + priekinis 473758",30.21,Dunlop,HI-TEN STEEL HI-TEN STEEL,Paaugliams,,28,1,1
1374,Meteor Cosmic Junior“ dviračių pirštinės,19.61,,,,,,,
1375,"Dviračio priekaba, juodos ir pilkos spalvos, 65kg",208.66,,"Aliuminis 18"" / L 18 ALLOY",Paaugliams,,,,
1376,"Dviratis AZIMUT City Lux 28"" 2023 baltas-juodas",228.90,Azimut,,,,,,
1377,Nautilus“ U628 programuojamas dviratis treniruoklis,1426.26,,,,,,,
1378,"Dviratis Romet Rambler FIT 27.5"" 2023 juodas-red-18"" / L (Dydis: 18"" / L)",448.90,Romet,,,,,,
1379,Reebok Fitness I300/Rožinė treniruočių pirštinės,29.86,Reebok,,,,,,
1380,Spokey Piacenza W dviratininkų pirštinės 941079-941078-941077,30.85,Spokey,,,,,,
1381,Tempish C-Mee Jr šalmas 102001091,56.33,Tempish,,,,,,
1382,Dviračio šalmasHi-tec Mtbunny,50.07,,,,,,,
1383,šalmas Coolslide Nuts Jr,43.27,Coolslide,,,,,,
1384,"dviračio spyna su kodu ir tvirtinimo laikikliu, Combo Flex 1200/10C OSKF012001006C0XP",26.53,Flex,,,,,,
1385,Dviračio šalmas Radvik Fulljoe,114.19,Radvik,,,,,,
1386,"Dviračio remonto stovas, 102-160cm, aliuminis, sulankstomas",146.88,,,,,,,
1387,Urbis šalmas 102001089,56.49,,,,,,,
1388,Radviko šlako šalmas 92800354330,69.18,,,Vyrams,,,,
1389,Dviračių pirštinės 4F U058 W 4FSS23AFGLU058 56S,34.64,,Aliuminis ALLOY,,,,,
1390,"GZR Heritag-e -sähköpyörä, 44 cm",4235.99,GZR,"Aliuminis 19"" / L 19 ALLOY",Paaugliams,,26,21,21
1391,"GZR Forzar-e SR sähköpyörä, 49 cm",1819.99,GZR,Aliuminis 46 cm / XS ALLOY,Paaugliams,,,9,9
1392,Dviratis Cube Cubie 120 walk lightblue'n'baltas 2023,225.49,Cube,anglies,ES,,,,
1393,"Dviratis Romet Jolene 6.1 26"" 2022 baltas-žalias-19"" / L (Dydis: 19"" / L)",359,Romet,aliuminis,ES,,,,
1394,Elektrinis dviratis Cube Supreme Sport Hybrid ONE 500 Easy Entry baltas'n'juodas 2023-46 cm / XS (Dydis: 46 cm / XS),2228.90,Cube,aliuminis,ES,,,,
1395,Mountain bike MMR RAKISH SL 00 EX - TEAM - dydis XL / 23/2024,4419.99,MMR,aliuminis,ES,,,,
1396,Mountain bike MMR Woki 50 EX - Sidabrinis N Juodas - dydis M / 23/2024,755.99,MMR,20.1,,,,,
1397,MMR MPN,755.99,MMR,,,,,,
1398,MMR MPN,755.99,MMR,20.1,,,,,
1399,"Fiksuotos pavaros dviratis, juodas ir mėlynas, 700c, 51cm",240.71,vidaXL,,,,,,Taip
1400,GORUNNER E-BIKE MINI 2.0 - Koksgrå,845.99,Gorunner,,,,,,Taip
1401,"Fiksuotos pavaros dviratis, baltas ir žalias, 700c, 51cm",240.71,vidaXL,,Vaikams,,,,
1402,Hurtel Neperšlampamas dviračių dangtis S dydžio - juodas,22.87,Hurtel,,,,,,
1403,"Rockbros dviračio šalmas 10110004004, M dydžio, mėlynas ir baltas",46.15,Rockbros,,,,,,
1404,TOVE DESERT BEIGE bėgimo dviratukas,98.54,,,,,,,
1405,GOSWIFT bėgimo dviratėlis švelniai geltonos spalvos,128.09,,Plienas,,,,,
1406,4105 Qplay Triratis dviratukas Cosy Juodas,141.68,Qplay,Metalas,,,,,
1407,Dviratis Turbo pink,88.23,Pink,,,,,,
1408,"DRAGON“ bėgimo dviratis su stabdžiais, raudonas",75.21,Dragon,,,,,,
1409,Balansinis dviratis DRAGON AIR Mint,96.47,Dragon,,Vaikams,,,,
1410,Balansinis dviratis Trainer raudonas,82.90,Trainer,Plienas,,,,,
1411,Qplay Dviratis triratukas Elite raudonas,105.45,Elite,,,,,,Taip
1412,LIONELO dviratis bėgikams Alex Turquoise,101.67,Lionelo,,,,,,Taip
1413,Bėgimo dviratis MARSHALL AIR Mėlyna,98.49,Marshall,,,,,6,6
1414,Rockbros dviračio šalmas L dydžio - mėlynos ir rožinės spalvos,46.15,Rockbros,"Aliuminis 21"" / L 21 ALLOY",Paaugliams,,,,
1415,Rockbros stovas dviračiams su greito atleidimo mechanizmu – juodas,27.29,Rockbros,,,,,,
1416,"Kalnų Dviratis - Huffy Stone Mountain 20""",189.99,Huffy,,,,,,
1417,"Dviratis Romet Wagant 5 28"" 2023 žalias-ruda-21"" / L (Dydis: 21"" / L)",508.90,Romet,Aliuminis Unisex,,Vieta,20,Shimano 7-pavarų Shimano Išorinės,1
1418,Milly Mally Triratukas,68.19,Milly Mally,,"Moterims
Vyrams",,,,
1419,Meteor Teddy Builder Junior dviratininkų pirštinės 26184-26185-26186,19.61,,anglies,,,,,48/35
1420,Dviratis 20 elektrinis Engwe LE20 pilkas dviguba baterija,1999,Engwe,anglies,,,,,34
1421,"Elektrinis dviratis HONBIKE UNI4, baltas",1678.90,Honbike,anglies,,,,,34
1422,MMR MPN,4039.99,MMR,anglies,,,,,52/36
1423,MMR MPN,4505.99,MMR,anglies,,,,,48/31
1424,MMR MPN,4505.99,MMR,anglies,,,,,34
1425,MMR MPN,4959.99,MMR,aliuminis,,,,,40
1426,MMR MPN,2535.99,MMR,anglies,,,,,52/36
1427,MMR MPN,5489.99,MMR,anglies,,,,,
1428,MMR MPN,1739.99,MMR,anglies,,,,,50/34
1429,MMR MPN,4959.99,MMR,anglies,ES,,,,34
1430,MMR MPN,3199.99,MMR,anglies,,,,,34
1431,MMR MPN,2879.99,MMR,anglies,,,,,34
1432,MMR MPN,3749.99,MMR,anglies,ES,,,,34
1433,MMR MPN,2219.99,MMR,"Aliuminis 18"" / L 18 ALLOY",Vyrams,,,,
1434,MMR MPN,2219.99,MMR,anglies,,,,,34
1435,MMR MPN,5625.99,MMR,anglies,,,,,48/35
1436,"Dviratis Romet Rambler R6.4 26"" 2023 baltas-auksinis-18"" / L (Dydis: 18"" / L)",448.90,Romet,anglies,,,,,50/34
1437,MMR MPN,3359.99,MMR,anglies,,,,,
1438,MMR MPN,3959.99,MMR,anglies,,,,,50/34
1439,MMR MPN,3839.99,MMR,anglies,,,,,48/35
1440,MMR MPN,3199.99,MMR,"Aliuminis 21"" / XL 21 ALLOY",Paaugliams,,28,7,7
